Day,Time,Type,Title,Presenter,Abstract,Youtube,Slides
Sat,14:15,Normal,Just how far can you go with FOSS?,Peter Birch,"Based on experience of guiding engineering at a silicon startup using FOSS tools and a strategy of open sourcing where possible, this presentation will explore where that limit is today, lessons learnt from this strategy, and some tips for others considering such an approach.",,
Sat,14:30,Break,Coffee break,,,,
Sat,14:45,Normal,Third Time's the Charm - Experiences Embedding 'Chip Design' into Curriculum and Workforce Development at The University of Sheffield,"John Goodenough
","The Microelectronics Systems Group at Sheffield University has been running multiple experiments over the last three years in how to embed Chip Design into a workforce development program including undergraduate and masters curriculum and student outreach. Aligning with national skills initiatives, getting funding for a sustainable program, dealing with learning outcomes, accreditation, dealing with the commerical ecosystem are all fun topics - beyond the technical. What drove us to use open source - to trial certain open source platforms and assets, what were our experiences, where are the gaps, and how do we move forward?

This is the third time I have tried to deliver this presentation having been thwarted by travel to both OrConf24 and Latchup25 hopefully the travel gods will smile on me. I will provide a quick update on the UK national zeitgeist in Semiconductors as part of this talk which may be of interest to the room - you will be happy that Open Srouce is a key feature of our Skills and Design Platform Initiative.",,
Sat,15:15,Normal,Shaping Tomorrow’s Chip Designers: Open-Source Initiatives at IHP,Christian Wittke,"This talk will present the latest open-source education activities at IHP, with a particular focus on the newly launched Open Source Chip Design Challenge, developed as part of the DI-OCDCpro project. This initiative introduces a competitive and hands-on training format aimed at students, career changers, and researchers, enabling them to complete a full open-source tapeout using real-world design flows. For the test run planned within the project, the challenge will use open-source EDA toolchains and target the IHP open-source SG13G2 technology.
In addition to the challenge, the talk will briefly highlight the progress of the open-source EDA courses (digital and analog) developed within the FMD-QNC project at IHP. Following their first successful trial runs in early 2025, participant feedback has been largely integrated into the course content. All materials are openly licensed and made publicly available via Git repositories.
The session will provide insights into the structure, motivation, and early outcomes of these initiatives, demonstrating how open-source tools and methodologies are being used to foster semiconductor education in Germany and beyond. This work is funded by the German Federal Ministry of Research, Technology and Space (BMFTR) as part of the DI-OCDCpro project (Funding Code: 16ME0940) and the FMD-QNC project (Funding Code: 16ME0831).",,
Sat,15:45,Normal,EuroCDP: the open branch,Macarena Martinez-Rodriguez,"This presentation will provide a brief overview of the EuroCDP (European Chip Design Platform), with a special focus on its open branch. The talk will highlight the key components available to the community, including an Open Source Software (OSS) toolbox for Level 0 users and an OSS sandbox environment for Level 1 and Level 2 users. The platform is designed to empower a broad range of stakeholders by enabling access to open EDA tools and an open IP catalog, all within a transparent and collaborative framework.",,
Sat,16:00,Normal,How We Built a Semiconductor Startup in 6 Weeks based on an Open Source Ecosystems,Mohamed Kassem,"In this talk, we’ll share the story of how three engineers launched a semiconductor startup—ChipFoundry.io—in just six weeks, thanks to the open-source silicon ecosystem. With zero proprietary EDA licenses and no upfront IP costs, we built a real business around accessible, reproducible chip design.

We’ll highlight how tools like OpenLane, the Sky130 PDK, the Caravel SoC template, and open IP libraries allowed us to go from concept to a working ASIC flow within weeks. We’ll also cover what worked, what didn’t, and how the vibrant community helped us overcome blockers that would’ve stalled a conventional startup for months.

This is a talk about speed, leverage, and the power of open collaboration in a space once reserved for giants.",,
Sat,16:15,Normal,tileable FPGA based acoustic camera,Camilo Soto,"Sesenta: Open source FPGA based tileable acoustic camera
sesenta is a tool for creation of acoustic cameras. has a modular design. It consists of 2 parts: the microphone array and FPGA based control boards. Each array is a board with a lattice of 60 microphones designed to work in conjunction with other arrays (tile of arrays). A Sesenta can work independently, but the ability to use it as a tile allows for an expanded range.",,
Sat,16:30,Normal,"Tiliqua - Accessible, Reconfigurable Audio DSP Platform",Sebastian Holzapfel,"[Tiliqua](https://github.com/apfelaudio/tiliqua) is an open hardware development platform, DSP library and collection of examples (built in Amaranth HDL) that aims to make FPGA-based audio and video synthesis more accessible. This talk builds on [last year's edition](https://fossi-foundation.org/orconf/2024#synthesizing-music-synthesizers), this time covering some war stories from the past 12 months of getting Tiliqua hardware ready to ship, and all the new features added to the DSP/RTL library since then. We'll cover some fun topics such:

* Implementing low-latency USB host purely in gateware
* Dynamic frequency scaling for display switching
* New DSP cores and example projects
* How we are adding first-class fixed-point types to the Amaranth language
* Lessons learned from shipping hardware (and some tricks for passing CE/EMC)

As we walk through each theme, this talk will include some live demos on a small Eurorack system demonstrating each.",,
Sat,16:45,Normal,WIP,Andrew Kahng,WIP,,
,,,,,,,
,,,,,,,
,,,,,,,
,,Lightning Talk,Design Understanding via Experimentation and Testing,Gus Henry Smith,We demonstrate how we can use LLMs to develop a deep understanding of complex designs via simple iterative experimentation. ,,
,,Lightning Talk,Bamlet: A VLIW SIMT Processor for Accelerators,Ben Reynwar,"[Bamlet](https://github.com/benreynwar/zamlet) is a VLIW SIMT processor designed to be used in a many-core accelerator mesh. Written in Chisel, tested with cocotb and PPA using OpenROAD-flow-scripts.",,
,,Lightning Talk,Machine Readable Architecture and Platform Automation with Jetbrains MPS Language Framework,"Johannes Schreiner
","Jetbrains MPS is a powerful open source framework for defining and entering single source data using custom DSLs (Domain Specific Languages). This presentation shows how it can be used to capture machine-readable single source data on all levels of abstractions: to model architecture, to define configurations their constraints, collect targeted product variants down to the description of HSI (SFR/CSR) in a System RDL style.",,
,,Lightning Talk,Closing Gaps in Open Secure Hardware Value Chains,"A. Weber, N. Herfurth, S. Andreev","This presentation will address: 
1. Motivations regarding security within the German research projects HEP and Sign-HEP. These projects are about creating open security modules with an open tool chain and PDK. Any potential attacks from insiders or outsiders need to be taken into account. If properly addressed, the approach will allow confidential communication, secure boot, code-signing, etc.
The presentation will furthermore introduce two new documents concerning plans for action, namely:
2. High-level specifications about how to design a Caliptra-like security module, with an emphasis on open components without vulnerabilities. The specification is planned to be made available ahead of the conference. It contains information about our plans to design an open, hardware-based random number generator. Furthermore, an extension to the IHP-Open130-G2 PDK will be provided, i.e. root of trust elements as a proprietary, certifiable module, usable for industrial adoption, with free access to academia. We encourage industry to express interest in our approach, experts to comment, and media to report about the planned open security module design. 
3. Furthermore, a Working Paper will be presented describing paths for open- source hardware. The paper addresses issues such as a) already emerging products, b) easing innovation, c) issues of global co-ordination and 4) paths towards more efficient, more open and more secure fabs. The paper is already available at https://hep-alliance.org/Project/.",,
,,Lightning Talk,osNoC: Open-Source Network-on-Chip,José Manuel Rocher González,"This talk describes the effort carried out to make our in-house Network-on-chip available to a wider commutity. To that end, the Network Interface (NI) was redesigned to support a broader range of communication protocols, including AXI-MM and AXI Stream. This effort targets a significant gap in open-source NoC architectures, where standard-compliant, reusable IP blocks are rarely available. By contributing these components as open-source, the project aims to improve accessibility and foster wider adoption and collaboration in the hardware research community.",,
,,Lightning Talk,BAFFI: a bit-accurate fault injection tool for dependability assessment of FPGA prototypes,Ilya Tuzov,"BAFFI is an open-source FPGA fault injection (FFI) tool that automates dependability assessment of FPGA prototypes. It addresses some important limitations of existing FFI methodologies for the current generation of AMD devices, such as the coarse granularity of FI experiments and the lack of support for ASIC fault models. Like most modern FFI tools, BAFFI relies on the partial runtime reconfiguration (RTR) technique to emulate hardware faults. Additionally, BAFFI maps the configuration memory (CM) bits with the hierarchical design netlist for the main types of logic cells. This mapping enables targeting any selected component in the design tree for fault injection, either individual look-up tables (LUT) or registers, which provides finer-grain analysis capabilities than alternative tools and eliminates the need for area constraints. At the same time, BAFFI extends the set of fault models beyond the commonly considered single event upsets (SEU) in CM, to support the emulation of transient ASIC faults in the storage cells by orchestrating the manipulation of multiple associated CM bits. This talk provides further details on the architecture and capabilities of BAFFI and exemplifies its application to an open-source RISC-V SoC (NOELV) prototyped on an AMD Virtex Ultrascale+ FPGA.",,