Day,Time,Type,Title,Presenter,Abstract,Youtube,Slides
Sat,13:45,Normal,Resizing Your Expectations: Mastering Timing Closure with OpenROAD's Evolving Optimizer,Matthew Guthaus,"Achieving robust timing closure is paramount in modern ASIC design. This talk delves into the critical role of physical synthesis and timing optimization within the OpenROAD flow, with a particular focus on its powerful Resizer module. This presentation will highlight the significant recent advancements and capabilities integrated into OpenROAD's Resizer. We will explore how these updates enhance its ability to perform sophisticated gate sizing, buffer insertion, and netlist restructuring, leading to improved power, performance, and area (PPA) metrics. Attendees will gain practical insights into effectively constraining their designs and harnessing the latest features of the OpenROAD Resizer to achieve superior timing closure results for their open-source hardware projects. 

Prof. Guthaus also wants to meet up with others on Sunday to discuss timing closure challenges on your open-source projects.",https://youtu.be/DSuYAlh0KuE,https://drive.google.com/file/d/1jwZgUwEmRepHFawwp3lwg4J1kE-eeRaR/view?usp=sharing
Sat,14:00,Normal,"Mission-Specific Chips for Space: Open Tools, Real Systems, Radical Performance",Thomas Parry,"Space electronics operate in an environment that demands the highest levels of reliability, radiation tolerance, and performance - under some of the harshest constraints on Size, Weight & Power (SWaP). Yet system designers are consistently faced with a painful choice: use off-the-shelf terrestrial chips that aren’t built for the mission, or rely on space-rated parts that are expensive, obsolete, and lacking performance.

At SPHERICAL, we’re solving this problem by collapsing the gap between chips and systems. We build high-reliability, high-performance space systems by designing our own mission-specific chips - enabled by open-source tools and a modern, software-first methodology. This approach lets us deliver systems that are not only more capable but radically more flexible, auditable, and scalable.

This talk will walk through our design philosophy, the tool flows we’ve developed and adapted, and how we’re leveraging the open-source silicon ecosystem to deliver 10x improvements in performance, reliability, and configurability. We’ll close by reflecting on the opportunities and missing pieces for the open-source community to power the next generation of critical systems.",https://youtu.be/OiecIBoiciA,https://drive.google.com/file/d/108PyV7dbefr7UoFEdQKTxdR9yDV-KRO8/view?usp=sharing
Sat,14:15,Normal,Just how far can you go with FOSS?,Peter Birch,"Based on experience of guiding engineering at a silicon startup using FOSS tools and a strategy of open sourcing where possible, this presentation will explore where that limit is today, lessons learnt from this strategy, and some tips for others considering such an approach.",https://youtu.be/RnYYJwnDZ3I,https://drive.google.com/file/d/1FCxAImZ-JrgJpkoj8QNY7UDVXaJt1E1T/view?usp=sharing
Sat,14:30,Break,Coffee break,,,,
Sat,15:30,Normal,SystemVerilog Assertion Verification with CIRCT,Tobias Wölfel,"SystemVerilog Assertions are extensively utilized in the industry for the verification of silicon designs. However, support in open-source tools for this is limited. With the advent of CIRCT and the growing support for SystemVerilog, it is imperative to explore ways to extend this support to establish a more comprehensive verification system capable of handling concurrent assertions.",https://youtu.be/v9tBxopovt4,https://drive.google.com/file/d/1EWqzJk4sYa-40HGcD8-RVq15nylfl0K9/view?usp=sharing
Sat,15:45,Normal,Third Time's the Charm - Experiences Embedding 'Chip Design' into Curriculum and Workforce Development at The University of Sheffield,"John Goodenough
","The Microelectronics Systems Group at Sheffield University has been running multiple experiments over the last three years in how to embed Chip Design into a workforce development program including undergraduate and masters curriculum and student outreach. Aligning with national skills initiatives, getting funding for a sustainable program, dealing with learning outcomes, accreditation, dealing with the commerical ecosystem are all fun topics - beyond the technical. What drove us to use open source - to trial certain open source platforms and assets, what were our experiences, where are the gaps, and how do we move forward?

This is the third time I have tried to deliver this presentation having been thwarted by travel to both OrConf24 and Latchup25 hopefully the travel gods will smile on me. I will provide a quick update on the UK national zeitgeist in Semiconductors as part of this talk which may be of interest to the room - you will be happy that Open Srouce is a key feature of our Skills and Design Platform Initiative.",https://youtu.be/GzfmoSI4phU,
Sat,16:00,Normal,Shaping Tomorrow’s Chip Designers: Open-Source Initiatives at IHP,"Christian Wittke, Johanna Wallenborn","This talk will present the latest open-source education activities at IHP, with a particular focus on the newly launched Open Source Chip Design Challenge, developed as part of the DI-OCDCpro project. This initiative introduces a competitive and hands-on training format aimed at students, career changers, and researchers, enabling them to complete a full open-source tapeout using real-world design flows. For the test run planned within the project, the challenge will use open-source EDA toolchains and target the IHP open-source SG13G2 technology.
In addition to the challenge, the talk will briefly highlight the progress of the open-source EDA courses (digital and analog) developed within the FMD-QNC project at IHP. Following their first successful trial runs in early 2025, participant feedback has been largely integrated into the course content. All materials are openly licensed and made publicly available via Git repositories.
The session will provide insights into the structure, motivation, and early outcomes of these initiatives, demonstrating how open-source tools and methodologies are being used to foster semiconductor education in Germany and beyond. This work is funded by the German Federal Ministry of Research, Technology and Space (BMFTR) as part of the DI-OCDCpro project (Funding Code: 16ME0940) and the FMD-QNC project (Funding Code: 16ME0831).",https://youtu.be/n-wnvB0LiFE,https://drive.google.com/file/d/1lW54YeaSAIrZ2bZjFb5GSIi3_QI-w2Vv/view?usp=sharing
Sat,16:15,Normal,EuroCDP: the open branch,Macarena Martinez-Rodriguez,"This presentation will provide a brief overview of the EuroCDP (European Chip Design Platform), with a special focus on its open branch. The talk will highlight the key components available to the community, including an Open Source Software (OSS) toolbox for Level 0 users and an OSS sandbox environment for Level 1 and Level 2 users. The platform is designed to empower a broad range of stakeholders by enabling access to open EDA tools and an open IP catalog, all within a transparent and collaborative framework.",https://youtu.be/1zxDEVJSW7M,https://drive.google.com/file/d/1YZ5ilDQkuIv83t0-PSnoAyVqPNoHFBE5/view?usp=sharing
Sat,16:30,Normal,Realising low cost and simple IC design - ChipFoundry and ChipFlow collaboration,Rob Taylor,"This talk will cover the background, technical aspects, and future plans of the recently announced collaboration between ChipFoundry and ChipFlow, including:

* Background
* A new graphical SoC tool
* Full in browser experience
* Language support
* European and US programs

We will also announce a new upcoming competition, continuing the legacy of Efabless’s Chipalooza!",https://youtu.be/7VDqqZDfOhE,
Sat,16:45,Normal,Open source chip design: for fun and for profit,Andreas Olofsson,"Open source EDA has come a long way since I first ""saw the light"" while founding the parallel processor company Adapteva in 2008. In this talk I will present my journey as a user and contributor to open source EDA and point out some of the technology gaps that still remain. I will then explain how Zero ASIC leverages open source tools successfully in our day to day business model. Finally, I will present some of our existing projects (SiliconCompiler, Switchboard, Logik, Lambdalib, LambdaPDK, UMI) and disclose a brand new open source project.",https://youtu.be/Z27-kuD0fyA,https://drive.google.com/file/d/1lSWqPqBzwVzRc6ks3Zy27Bz8Mknqz1lp/view?usp=sharing
Sat,17:00,Normal,"Tiliqua - Accessible, Reconfigurable Audio DSP Platform",Sebastian Holzapfel,"[Tiliqua](https://github.com/apfelaudio/tiliqua) is an open hardware development platform, DSP library and collection of examples (built in Amaranth HDL) that aims to make FPGA-based audio and video synthesis more accessible. This talk builds on [last year's edition](https://fossi-foundation.org/orconf/2024#synthesizing-music-synthesizers), this time covering some war stories from the past 12 months of getting Tiliqua hardware ready to ship, and all the new features added to the DSP/RTL library since then. We'll cover some fun topics such:

* Implementing low-latency USB host purely in gateware
* Dynamic frequency scaling for display switching
* New DSP cores and example projects
* How we are adding first-class fixed-point types to the Amaranth language
* Lessons learned from shipping hardware (and some tricks for passing CE/EMC)

As we walk through each theme, this talk will include some live demos on a small Eurorack system demonstrating each.",https://youtu.be/XyGxTcwcONQ,https://drive.google.com/file/d/1srzvDqwb-4fi8_K-JMzLPAEonLntRx3B/view?usp=sharing
Sat,17:30,Normal,Podcast live interview: History and Future of OpenROAD,Andrew Kahng and FOSSi Foundation,"Live interview with Andrew Kahng, project lead of OpenROAD. We will talk about how the program came together, the challenges it faced and how it became a household name. Of course we will also talk about the future of OpenROAD.",,
Sat,20:00,Break,"Dinner at Restaurante Cocoa Patacona - Playa de la Patacona, Valencia",,,,
Sat,21:30,Break,Lightning Talks,,,,https://drive.google.com/file/d/1CjtttA_SwWOVHMbwusZg4K1LxEv-lNb3/view?usp=sharing
,,Lightning Talk,Design Understanding via Experimentation and Testing,Gus Henry Smith,We demonstrate how we can use LLMs to develop a deep understanding of complex designs via simple iterative experimentation. ,,https://drive.google.com/file/d/1oFwsKNu4uO0o4ricZyLm6hSSoMJpnaW7/view?usp=drive_link
,,Lightning Talk,Bamlet: A VLIW SIMT Processor for Accelerators,Ben Reynwar,"[Bamlet](https://github.com/benreynwar/zamlet) is a VLIW SIMT processor designed to be used in a many-core accelerator mesh. Written in Chisel, tested with cocotb and PPA using OpenROAD-flow-scripts.",,https://drive.google.com/file/d/18OVqgvUHUYFNhP2a85qBSlB6awm9JDMe/view?usp=drive_link
,,Lightning Talk,Machine Readable Architecture and Platform Automation with Jetbrains MPS Language Framework,"Johannes Schreiner
","Jetbrains MPS is a powerful open source framework for defining and entering single source data using custom DSLs (Domain Specific Languages). This presentation shows how it can be used to capture machine-readable single source data on all levels of abstractions: to model architecture, to define configurations their constraints, collect targeted product variants down to the description of HSI (SFR/CSR) in a System RDL style.",,https://drive.google.com/file/d/1PWgKY5b2WHbf_7gd67Z4fUY7QJVw9pel/view?usp=drive_link
,,Lightning Talk,Closing Gaps in Open Secure Hardware Value Chains,"A. Weber, N. Herfurth, S. Andreev","This presentation will address: 
1. Motivations regarding security within the German research projects HEP and Sign-HEP. These projects are about creating open security modules with an open tool chain and PDK. Any potential attacks from insiders or outsiders need to be taken into account. If properly addressed, the approach will allow confidential communication, secure boot, code-signing, etc.
The presentation will furthermore introduce two new documents concerning plans for action, namely:
2. High-level specifications about how to design a Caliptra-like security module, with an emphasis on open components without vulnerabilities. The specification is planned to be made available ahead of the conference. It contains information about our plans to design an open, hardware-based random number generator. Furthermore, an extension to the IHP-Open130-G2 PDK will be provided, i.e. root of trust elements as a proprietary, certifiable module, usable for industrial adoption, with free access to academia. We encourage industry to express interest in our approach, experts to comment, and media to report about the planned open security module design. 
3. Furthermore, a Working Paper will be presented describing paths for open- source hardware. The paper addresses issues such as a) already emerging products, b) easing innovation, c) issues of global co-ordination and 4) paths towards more efficient, more open and more secure fabs. The paper is already available at https://hep-alliance.org/Project/.",,https://drive.google.com/file/d/1sio_5NHW3BMoC4c8SFfc_3bj2FrjZkAz/view?usp=drive_link
,,Lightning Talk,osNoC: Open-Source Network-on-Chip,José Manuel Rocher González,"This talk describes the effort carried out to make our in-house Network-on-chip available to a wider commutity. To that end, the Network Interface (NI) was redesigned to support a broader range of communication protocols, including AXI-MM and AXI Stream. This effort targets a significant gap in open-source NoC architectures, where standard-compliant, reusable IP blocks are rarely available. By contributing these components as open-source, the project aims to improve accessibility and foster wider adoption and collaboration in the hardware research community.",,https://drive.google.com/file/d/1jnJj-Pqejy0Ki7dbHqCFVXrnb0PP_3M-/view?usp=drive_link
,,Lightning Talk,BAFFI: a bit-accurate fault injection tool for dependability assessment of FPGA prototypes,Ilya Tuzov,"BAFFI is an open-source FPGA fault injection (FFI) tool that automates dependability assessment of FPGA prototypes. It addresses some important limitations of existing FFI methodologies for the current generation of AMD devices, such as the coarse granularity of FI experiments and the lack of support for ASIC fault models. Like most modern FFI tools, BAFFI relies on the partial runtime reconfiguration (RTR) technique to emulate hardware faults. Additionally, BAFFI maps the configuration memory (CM) bits with the hierarchical design netlist for the main types of logic cells. This mapping enables targeting any selected component in the design tree for fault injection, either individual look-up tables (LUT) or registers, which provides finer-grain analysis capabilities than alternative tools and eliminates the need for area constraints. At the same time, BAFFI extends the set of fault models beyond the commonly considered single event upsets (SEU) in CM, to support the emulation of transient ASIC faults in the storage cells by orchestrating the manipulation of multiple associated CM bits. This talk provides further details on the architecture and capabilities of BAFFI and exemplifies its application to an open-source RISC-V SoC (NOELV) prototyped on an AMD Virtex Ultrascale+ FPGA.",,https://drive.google.com/file/d/1qlIppgiqxL54rH9RyzCSKKok4WhuZQrz/view?usp=drive_link
,,Lightning Talk,tileable FPGA based acoustic camera,Camilo Soto,"Sesenta: Open source FPGA based tileable acoustic camera
sesenta is a tool for creation of acoustic cameras. has a modular design. It consists of 2 parts: the microphone array and FPGA based control boards. Each array is a board with a lattice of 60 microphones designed to work in conjunction with other arrays (tile of arrays). A Sesenta can work independently, but the ability to use it as a tile allows for an expanded range.",,https://drive.google.com/file/d/14ZKMvDFHhnPl39sn9PeHCXWM-GNV-IyW/view?usp=drive_link
,,Lightning Talk,Property-based testing,Christiaan Baaij,,,https://drive.google.com/file/d/12QW5xra-hi4lcs2eTs1WJItBBkhn14wb/view?usp=drive_link
,,Lightning Talk,Verification with Java or Scala,Martin Schoeberl,,,https://drive.google.com/file/d/1V_3gJqiQMdw4WxnkXs_iG4aOx6oE9N3J/view?usp=drive_link
,,Lightning Talk,Making modern and open source silicon clone of classical 8-bit Zilog's Z80 on 180 / 130 nm,"Renaldas Zioma
","Quick overview of the current state of work on silicon proven, pin compatible, open-source replacement for classic Zilog Z80:

* tapeouts and physical chips fabricated with Skywater 130nm via TinyTapeout & ChipIgnite,
* challenges with bring up and testing of the silicon,
* mistakes found and lessons learned,
* DIP40 PCB for the new silicon,
* future plan for crowd sourcing.",,https://drive.google.com/file/d/16LFfKaAxEvC_vtllP26w1v-VrGvLLpeg/view?usp=drive_link
,,Lightning Talk,Frans' spicy takes 🌶️,Frans Skarman,,,https://drive.google.com/file/d/1tb1mbcFpEpxhHcu0zUQXP2Gr2RA3pkkZ/view?usp=drive_link
,,Lightning Talk,Skyscrapers to Silicon,Jack English,,,https://drive.google.com/file/d/1138pgPcF3KpH85u1qFeb47wiRX_7y3GU/view?usp=drive_link
,,Lightning Talk,Where Should AI Fit in the Future SoC Flow,Kaiyuan Yang,,,https://drive.google.com/file/d/1rXE2ivJfxYK3Ker8SzIqTK7clc2rCTtx/view?usp=drive_link
,,Lightning Talk,A Topology-Independent and Scalable Methodology for Automated Analog Design,Daniel Arevalos,,,https://drive.google.com/file/d/1CTcHeDGRKRJHWUFGo_xghuyPlz3eoZg-/view?usp=drive_link