Day,Time,Type,Title,Presenter,Notes,Abstract,Youtube,Slides
Fri,09:00,Break,Welcome Coffee,Mingle with a nice coffee in front of venue,,,,
Fri,10:30,Normal,Opening,FOSSi Foundation team,,,https://youtu.be/yfV7jcxUGaY,https://drive.google.com/file/d/1uaggNCrCk-Gwt-yEcp6PWvNWmb1iHqIK/view?usp=sharing
Fri,10:40,Normal,Using Clash to enable logically synchronous data centers,Christiaan Baaij,Tool,"The fact that all the computers and switches in a data center are mostly independent and asynchronously operating entities can cause issues. This includes a wide variance in end-to-end latency (“lag spike”), to efficient compute resource usage; and on top of that: all the buffers that are all over the place are consuming a lot of energy. Imagine, however, what would happen if you could treat your entire data center as a synchronous digital circuit: latency becomes deterministic, scheduling applications for efficient resource usage becomes easier, and you can drastically reduce buffer sizes. This is what [the Bittide project](https://www.bittide.io/), aims to achieve: to bring ‘logical’ synchrony to data centers. This talk will explain what ‘logical’ synchrony is and how we used [Clash](https://clash-lang.org/), to build the hardware support to enable it.",https://youtu.be/FylD5cWAFmg,https://drive.google.com/file/d/1-SmzHF5W3eYg1MAT4oDesjG7OnOnIwJx/view?usp=sharing
Fri,11:00,Normal,The Saturn Vector Unit: Design of a Fully Compliant Open-Source RISC-V Vector Unit,Jerry Zhao,IP,[https://github.com/ucb-bar/saturn-vectors](https://github.com/ucb-bar/saturn-vectors),https://youtu.be/5eitFdW8CCM,
Fri,11:20,Normal,VexiiRiscv : A Debian demonstration,Charles Papon,Core,"[The VexiiRiscv (Vex2Risc5) project](https://github.com/SpinalHDL/VexiiRiscv) aim at replacing VexRiscv and extends its scope with features such as multi-issue, hardware prefetcher, 64 bits support, ... This presentation will mainly be a live demonstration of the project running Debian on FPGA, exposing the level of performance achievable on such system including boot, userland, some demos and finaly a few slides.",https://youtu.be/dR_jqS13D2c,https://drive.google.com/file/d/1QJCoKn67IypC3n2OAC7N4jS-BjxOWb1F/view?usp=sharing
Fri,11:40,Normal,FazyRV: A RISC-V Core that Scales to Your Needs,Meinhard Kissich,Core,"[FazyRV](https://github.com/meiniKi/FazyRV) is a scalable RISC-V core that can be synthesized into a (1-)bit-serial, 2-, 4-, or 8-bit-serial implementation to fulfill your performance requirements with the least area (resp. resources) demand. FazyRV provides manifold variants to adapt to the target technology by, e.g., avoiding dual-port BRAM at the cost of an additional clock cycle. Contradictory to hand-optimized cores at the gate level, FazyRV tries to avoid manual low-level optimizations to increase readability and simplify adaptations. This talk gives an insight into the open-source FazyRV core and its design objectives. We show how the area demand scales, answer why there is no 16-bit variant, discuss how the performance can be improved, and outline possible extensions to improve the current FazyRV design.",https://youtu.be/rRPVVCbpF5M,https://drive.google.com/file/d/1agGsPXyNRSzBQAJPivFP0lVqb30tZE-e/view?usp=sharing
Fri,12:00,Normal,A very small cross compiler for OpenRISC and maybe your homebrew processor,Jörg Mische,Tool,"[PunyCC](https://github.com/bobbl/punycc) is a cross compiler for a very small subset of C. Only one source file, no preprocessor, no structs, no floating point and only one datatype that can be used as unsigend int or pointer to char. Due to these simplifications the compiler source code is very small and can easily be adopted to a new target instruction set. So far PunyCC supported 4 architectures: ARM Thumb-2, RISC-V, x86-32 and WebAssembly. It can compile itself and thus provides cross compilers from any of the instruction sets to any other. This talk presents how easy it is to add OpenRISC support to PunyCC. Use it as a blueprint for porting PunyCC to your own special instruction set.",https://youtu.be/vv4WAGwwY_4,
Fri,12:30,Break,Lunch Break,,,,,
Fri,13:30,Normal,Roadmap for Open Source EDA in Europe,Stefan Wallentowitz,Advocacy,"Open source silicon and open source EDA tools have been identified as strategically important for European sovereignty. The [GoIT!](https://wiki.goit-project.eu/index.php?title=Main_Page) project and FOSSi Foundation have been tasked with creating a roadmap and recommendations for open source EDA in Europe. In this presentation, we will give an overview about the roadmap and initiate the community feedback period, which is extremely important for the success of the roadmap.",https://youtu.be/GNBHe6HSCNs,https://drive.google.com/file/d/1c1SjOVsKGGEhfZ9z0O9kjgo5ILczMkSD/view?usp=sharing
Fri,14:00,Normal,"New open source IP, tools and verification flows for Caliptra 2.0",Karol Gugala,"IP, Verification","CHIPS Alliance’s open source [Caliptra Root of Trust Project](https://github.com/chipsalliance/Caliptra) (a collaboration between AMD, Google, Microsoft and NVIDIA) is heading towards a 2.0 release. This talk will cover recent open source developments resulting from [Antmicro’s](https://antmicro.com/) involvement in the project, expanding on last year’s update at ORConf: a new open source I3C core built for use in future Caliptra integrations, further developments in the [RISC-V-based VeeR](https://github.com/chipsalliance/Cores-VeeR-EH1) core including PMP, ePMP and User Mode support, fully open verification of the AXI bus interface with Verilator and axi-vip verification IP and a number of improvements related to coverage visualization, automated documentation and chip aggregation. The talk will also present the SystemRDL integration with Renode speeding up generation of the co-simulation verification environment, as well as Caliptra’s entry in Antmicro’s System Designer which lets you explore the SoC’s structure, RTL and verification artifacts from a block diagram perspective.",https://youtu.be/hXjUoCGlXyM,
Fri,14:20,Normal,The future of FuseSoC,Olof Kindgren,Tool,"While individual projects like Linux and GCC paved the road for open source software success, it can be argued that the thing that really enabled scaling up development of Linux-based solutions was the idea of package management. Having a common way to install software and describe their relations made it possible to rapidly create custom systems. The same can be said for language-specific package managers like pip for Python or Cargo for Rust.

On the chip design side, [FuseSoC](https://fusesoc.net/) has been doing the same thing since its inception 2011. It is by now likely the world's most widely used package manager, both for open source projects and for proprietary code.

The background of FuseSoC has been presented several times over the years, so this presentation aims to instead look ahead and see what new features that are in store for FuseSoC and its sister project Edalize.",https://youtu.be/r-oRLR1bp3I,
Fri,14:40,Normal,Surfer - An Extensible and Snappy Waveform Viewer,Frans Skarman,Tool,"[Surfer](https://surfer-project.org/) is a new waveform viewer focused on extensibility and a snappy interface. This presentation will briefly show off Surfer, showcase off how an extensible waveform viewer can be used for more effective debugging such as translating types from high level HDLs, visualising the results of waveform analysis, or even as a teaching tool. The presentation will also showcase some recently added features such as transaction visualization, the ""Surver"" headless interface, and scriptable plugins.",https://youtu.be/0pcSoX1s_vc,
Fri,15:00,Break,Coffee Break,,,,,
Fri,15:40,Normal,APyTypes - NumPy for people that care about their bits,Oscar Gustafsson,Tool,"[APyTypes](https://github.com/apytypes/apytypes) is an array library for Python with highly configurable bit-accurate fixed-point and floating-point data types of arbitrary word length written in C++. Hence, it can be used to easily simulate finite word length effects and to provide reference data for hardware implementations. This talk discuss features of APyTypes, how to work with it, and how it compares against other libraries with a similar purpose.",https://youtu.be/DwcD8_Jvo2o,https://drive.google.com/file/d/10iYruL8d0Hm_Esm7AzMZaF0n6qoSJqpj/view?usp=sharing
Fri,16:10,Normal,Development of Certificate Courses and Status Quo of Digital EDA Course using IHP-SG13G2,Christian Wittke,"Education, PDK","This talk will present the ongoing effort and progress in creating the OS-EDA course. An overview of the available materials, lectures, and hands-on components will be included. Additionally, we will explain how to participate and use the materials independently. A first test run of the course, planned to be held in-house at IHP, will be announced during this talk at ORConf. The course's overall goal is to help participants understand and use open-source EDA tools to create an open-source tapeout, with IHP as the default target chip factory and the usage of OPENROAD. The course will be available in English, with all materials hosted in a public Git repository under an open-source license. This work is funded by the German Federal Ministry of Education and Research in the Project FMD-QNC (16ME0831).This talk will present the development of certificate courses within the FMD-QNC project, which will be part of an educational platform aimed at training individuals from trainees to academics. The OS-EDA courses under development at IHP target academics and career changers. We will present the progress in creating the digital OS-EDA course, including an overview of the available materials, lectures, and hands-on components. Additionally, we will explain how to participate and use the materials independently.

A first test run of the course, planned to be held in-house at IHP, will be announced during this talk at ORConf. The overall goal of the course is to help participants understand and use open-source EDA tools to create an open-source tapeout, with IHP as the default target chip factory and the use of OPENROAD.

The course will be available in English, with all materials hosted in a public Git repository under an open-source license. This work is funded by the German Federal Ministry of Education and Research as part of the FMD-QNC project (16ME0831).",https://youtu.be/Ozd_yXoExLo,
Fri,16:30,Normal,"Making sound & graphics ASIC: ""Drop"" audio-visual demo chip on 130nm",Renaldas Zioma,Design,"Design and development process of the ""Drop"" demo for the [TinyTapeout Demoscene 2024 competition](https://tinytapeout.com/competitions/demoscene/). The dedicated ASIC is a self contained 150x220 um piece of silicon built on a 130 nm process, requires no CPU, GPU or external memory and produces VGA signal in a ""racing the beam"" fashion. The talk will cover tools and hardware used during the development of the demo. Optimisation techniques to fit multiple graphical effects into extremely tight area of 150x220 um and quick comparison of the dedicated ASIC design vs ""classical"" chips for graphics and audio synthesis.",https://youtu.be/1WGwC3_XAyM,
Fri,16:50,Normal,My open source analog microelectronics journey,Matt Venn,"Analog, Design","Analog microelectronics is a crucial but often overlooked part of ASIC design. In this talk I will share my experience getting started with analog microelectronics, and taping out my first few designs. I will cover motivation, tools, my designs, and my success and failures so far. The presentation will end with a discussion on how this fascinating topic fits into the wider picture of open source silicon and the next steps needed to enable radio transmitters and receivers.",https://youtu.be/rxoMU8cLbUY,https://drive.google.com/file/d/1nYjN7qe_cCnYnhc8PFjA-e7A1S2GGB6v/view?usp=sharing
Fri,17:30,Break,Drinks & snacks at confrence venue,,,,,
Fri,19:30,Break,Saturday End,,,,,
Sat,09:20,Normal,Open Source Standard Cell Library Design,Antoine Sirianni,PDK,"With the avenue of AI as a game changer, what would Open Source Standard Cell Library Design consist in to date? Where to start ? Let's focus on combinatorics to provide with an unexpected contribution.",https://youtu.be/cpYvwZsMajM,
Sat,09:40,Normal,Project Arrakeen: One API to rule all PDKs,Staf Verhaegen,PDK,"[Project Arrakeen](https://gitlab.com/Chips4Makers/c4m-arrakeen) is an umbrella project for providing a python framework for portable and scalable digital and analog circuits. It is based on the PDKMaster base project which provide a uniform API to PDK data and generation of circuit and layouts. On this base project other projects are being built that provide standard cells, IO cells, SRAM compiler and analog blocks. In this talk the state of the Arrakeen project and it's subprojects for the three supported open source PDKs, e.g. Sky130, IHP SG13G2 and GF180MCU will be presented.",https://youtu.be/6mTJ31eXVzA,
Sat,10:00,Normal,Porting of Proprietary PDK to Digital Open-Source EDA Tools,Tomasz Hemperek,PDK,"Open-source tools for ASIC design are gaining momentum due to their cost-effectiveness, customizability, and reliability. These tools have proven their value through multiple successful designs in recent years. This talk will present our experience in successfully porting a proprietary 110nm Process Design Kit (PDK) to open-source EDA tools such as Yosys and OpenRoad. We will discuss both the successes and challenges encountered during this process, using the prototype Gbit serial data link as a case study.",https://youtu.be/Y8DjcLrVtxw,https://drive.google.com/file/d/1FrzrVRWrFl1wcNpALPNG86PwXZeln9mf/view?usp=sharing
Sat,10:20,Normal,DFHDL: The 3-in-1 Abstraction Approach to Hardware Design,Oron Port,"Design, Tool","Join us for a dive into [DFHDL](https://dfianthdl.github.io/) (DFiant Hardware Description Language), where we break down a fresh approach to hardware design. This talk introduces a unique three-layer abstraction method that blends Dataflow (DF), Register-Transfer (RT), and Event-Driven (ED) models into one streamlined framework. We’ll explore how DFHDL simplifies and speeds up the logic design processes and our goals to do the same for verification. Expect a straightforward discussion on how each layer of DFHDL works, why it matters, and what it means for the future of hardware design. We’ll share real-life examples and insights that show DFHDL in action. Whether you’re deep into hardware design or just curious about how chips come to life, this talk has something for you. DFHDL is an opensource framework available at https://dfianthdl.github.io/ (WIP)",https://youtu.be/TC5z7WgdOuE,
Sat,10:40,Break,Coffee Break,,,,,
Sat,11:10,Normal,cocotb as a way towards a new verification methodology,Marek Cieplucha,Verification,"SystemVerilog and UVM have dominated digital verification, even though they are relatively old technologies with significant limitations.
The EDA industry's strategy has been to develop smarter (and more expensive) tools based on these technologies.
However, [Cocotb](https://www.cocotb.org/) offers a different approach. It minimizes the reliance on EDA tools (limited to just simulation) by enabling the vast capabilities of the Python ecosystem.

Is this a recipe for success? What challenges does it present? Is there room for both strategies in the future?

In this presentation, I will discuss some general considerations, as well as share experiences from successful deployments of the Cocotb flow in industrial projects (which might even be in your pocket right now).

Some fancy around-Cocotb ideas developed will be shown: usage of massive parallelism, flow unification with algorithm-level modeling and checkpointing.",https://youtu.be/h8u0Ic05zsI,
Sat,11:30,Normal,cocotb Gets A Glow Up: Fixes and Features of 2.0,Kaleb Barrett,Verification,"Since it's inception and the minting of 1.0, cocotb has carried with it several design issues that only API-breaking changes could fix. 2024 is the year those issues finally get fixed. [cocotb 2.0](https://docs.cocotb.org/en/latest/) includes changes to how tests are parameterized and selected, how tasks are managed, how HDL values are represented in Python, and how simulations are run. Tune in to this talk to learn how to leverage these new features and how to make your code 2.0 compliant.",https://youtu.be/n7Ektuv-ONk,https://drive.google.com/file/d/1nYjN7qe_cCnYnhc8PFjA-e7A1S2GGB6v/view?usp=sharing
Sat,11:50,Normal,Forastero: cocotb testbenches with batteries included,Peter Birch,"Verification, together with Stuart","Forastero is a Python library that builds on top of cocotb adding standard components like drivers, monitors, and scoreboards but without bringing the full weight of a UVM environment. While in some ways a spiritual successor to cocotb-bus, [Forastero](https://github.com/Intuity/forastero) goes further and provides mechanisms for generating complex random stimulus. In this talk I'll present how you can use Forastero to quickly construct a testbench around a DUT, driving and monitoring multiple interfaces, and producing complex stimulus patterns. Forastero is fully open source and comes with both documentation and examples. It can be found on GitHub at [github.com/Intuity/forastero](https://github.com/Intuity/forastero)",https://youtu.be/zfePaytPE84,https://drive.google.com/file/d/1UqwPRufEipbn-MsyMgZHy68FajgFfHOG/view?usp=sharing
Sat,12:10,Normal,Buckets of Coverage,Stuart Alldred,"Verification, right afterPeter","[Bucket](https://github.com/VyperCore/bucket) is a python-based functional coverage tool designed to work easily with cocotb(/Forastero). It allows for the easy creation of multiple nested covergroups and coverpoints with a straight forward sampling mechanism. Each coverpoint is a cross of one or more axes, with the ability to modify target hits, illegal or ignore status for each bucket. The data to be covered can be sampled directly from the DUT, higher levels of abstraction (such as entire CPU pipelines), or even parsing of logs/test output. Bucket is being actively developed and used by Vypercore for our own IP. It is fully open source and available at [github.com/VyperCore/bucket](https://github.com/VyperCore/bucket), where you can find further documentation and examples.",https://youtu.be/aj6vcV0Gozw,https://drive.google.com/file/d/18E4_ENisdt2rHehP24xag-OszOixYZRL/view?usp=sharing
Sat,12:30,Break,Lunch Break,,,,,
Sat,14:00,Normal,BYOL (Build Your Own Linter) - UVMLint for IEEE-UVM core code development,Ajeetha Kumari Venkatesan,Verification,"UVM is the most adopted design verification methodology in the field of ASIC and FPGA designs. Lint and static checking of code has proven to be very effective in projects that have wide user base, longer lifetime and distributed developers. During the recent UVM IEEE 1800.2-2023 release cycle, an observation was made regarding the potential application of a custom UVMLint solution to lint the UVM Base Class Library (BCL) as it gets developed, updated etc. We at AsFigo have developed custom rules for linting UVM BCL code on top of PySlint, an open-source SystemVerilog testbench linter. We intend to offer this as an opensource lint package to the UVM IEEE committee and to the general audience via GitHub. The eventual goal is to have these rules as gatekeepers via GitHub actions so that any future code addition to the UVM BCL is free from common pitfalls. Based on early brainstorming, below are some of the sample lint rules that are relevant to the UVM BCL codebase:

* Avoid race condition around ""static const"" (use localparam instead)
* Avoid one-liner conditional statements: 
  * `if (cond) $display (""cond"");`  
  * `if (cond) .. else $display` (""Else cond as single line""); 
  * `case..endcase` 
* Avoid one-liner code in loops: `for`, `repeat`, `while`, `do..while`, `foreach` 
* Use endlabels for elements such as `endclass`, `endfunction`, `endtask` etc.
* Flag non-virtual methods 

Typical UVMLint rules for a VIP user would be quite different from the requirements of UVM BCL. These rules are tailored for UVM BCL codebase.",,
Sat,14:20,Normal,Co-simulation with Renode DPI and SystemC interfaces for architectural exploration and development of SoCs,Piotr Zierhoffer,Verification,"The [Renode](https://renode.io/) simulation framework is being used in a number of projects and open source initiatives developing new ASIC-targeted IPs and SoCs. It lets you mix fast, functional full-system simulation with co-simulated RTL blocks. This talk will show how Renode's DPI interface support allows interfacing SystemVerilog IP simulated with Verilator or other DPI-capable simulators via a range of bus interfaces as well as present the newly-added SystemC TLM support. Renode's co-simulation capabilities together with features like trace-based modeling as well as flexible support of the RISC-V ISA including simple definition of custom instructions, help explore architectural choices, analyze the security and performance of in-development SoCs, develop software pre-silicon, and build rigorous, deterministic test suites which guide teams through the entire development lifecycle of SoCs.",,
Sat,14:40,Normal,Synthesizing Music Synthesizers,Sebastian Holzapfel,"Tool, IP","[Tiliqua](https://github.com/apfelaudio/tiliqua) is an open hardware development platform, DSP library and collection of examples (built in Amaranth HDL) that aims to make FPGA-based audio and video synthesis more accessible. The hardware itself is designed to integrate into the Eurorack ecosystem, or can be easily taken apart and used in custom instrument designs. This presentation will go through the Tiliqua hardware design, the RTL framework provided and some of the included example projects. The project is distributed under CERN-OHL-S-V2 and is under active development here: https://github.com/apfelaudio/tiliqua",,
Sat,15:10,Normal,Accelerating software development for emerging ISA extensions with cloud-based FPGAs: RVV case study,Marek Pikuła,"Tool, Core, cloud","The [RISC-V Vector Extension (RVV)](https://github.com/riscv/riscv-v-spec/blob/master/v-spec.adoc) promises an enhanced performance and power efficiency across various complex computational tasks. However, the efficient utilization of RVV demands careful consideration of the optimization approach. This article examines strategies for accelerating this process. Key challenges include assessing performance differences among algorithmic approaches and overcoming initial hardware constraints. FireSim provides a comprehensive solution by offering advanced software and hardware simulation capabilities. Utilizing FireSim, we started the process of enhancing source code with RVV instructions (called vectorization) for the pixman project. Our experience outlines the efficacy of a cloud-based FPGA simulation in expediting software development for emerging ISA extensions. Overall, FireSim facilitates faster iteration cycles and informed design decisions, benefiting individual developers and fostering collaboration in remote teams.",,https://drive.google.com/file/d/14TKegIEJe-dhHk_ROprpzYEQHTk--Jkh/view?usp=sharing
Sat,15:30,Normal,Digital Signal Processing: Modeling with Julia,David Hossack,Tool,"Digital signal processing (DSP) paths are usually simulated at a high level using C or MATLAB/Simulink models to confirm basic functionality and to assess whether signal processing requirements such as frequency response and signal-to-noise ratio are being met. Complex signal processing paths consist of cascades of sigma-delta modulators, filter stages, mixers, modulators, demodulators etc each of which have a corresponding high level model. A very simple framework has been developed in Julia to enable combinations of DSP stages to be evaluated. This talk will discuss the experience of using Julia to combine models written in Julia and C, and designs written in Verilog (using Verilator) in industrial settings over many years. The principles should also be applicable to C++ or Python evaluation environments.",,
Sat,15:50,Break,Coffee Break,,,,,
Sat,16:10,Normal,"OSVVM in a NutShell, VHDL’s #1 Verification Methodology",Jim Lewis,Verification,"[OSVVM](https://osvvm.org/) is a suite of libraries designed to streamline your VHDL entire verification process, boosting productivity and reducing development time. Each library provides independent capabilities, allowing selective adoption and a learn-as-you-go approach. Whether using directed or random testing, OSVVM facilitates writing concise and readable test cases for both simple unit/RTL tests and complex, full-chip or system-level FPGA and ASIC tests. OSVVM provides VHDL with verification capabilities that rival SystemVerilog + UVM. These include transaction-level modeling, verification components, co-simulation with software, randomized test generation, self-checking test support, verification data structures, comprehensive test reporting in HTML and text, and synchronization primitives. With OSVVM and a good team lead, any VHDL engineer can do verification – and have fun doing it. OSVVM grew rapidly during the COVID years, giving us better capability, better data structures, better test reporting (HTML and Junit), and scripting that is simple to use (and works with most VHDL simulators). This presentation will show how these advances fit into the overall OSVVM Methodology.",,
